ID,Name,Review,Netflix,Prime,Year,Director,Lead,Acting,Story,Execution,Profundity,Overall,Poster,Genre,Links,Image,Trailer
48,Coco,"Such a heartwarming movie this is! No wonder it got an Oscar for best animated film! It's about an aspiring musician Miguel, who is confronted with his family's ancestral ban on music, enters the Land of the Dead to find his great-great-grandfather, a legendary singer. the charcters are all quirky yet have a depth to them thus it doesn't feel like watching 'just-another-kiddie-movie'! The story is wonderfully written with perfect highs and lows and a point perfect of a climax which will sure to leave you in tears! Don't make the mistake of dismissing this movie as 'movies I am too mature for! It has a lot to offer and will completely justify the time you spend on it!",1,0,2017,Lee Unkirch,NA,NA,3.5,2.4,3.3,3.1,coco.png,animated,https://xmovies8.si/watch-coco-2017-1080p.39489-hd-online-free/watching.html,https://gdurl.com/41gU,https://www.youtube.com/embed/xlnPHQ3TLX8
49,Nightcrawler,"A real blockbuster of a movie this is! It basically revolves around a con man Lou Bloom who is desperate for work and stumbles upon the high octane job of video journalism and in his bid to get to the top, the lines become blurry between being an observer to the crime and being a participant himself so as to become the star of his own story. The acting by Jake Gyllenhaal portraits the perfectly efficient psycho that the story demands. The nocturnal underbelly of LA provides the setting for this film and includes some good chase sequences and a no-nonsense approcah to the storyline. Overall, grab some popcorn and turn down the lights. This movie here is a full on thriller entertainment.",1,0,2014,Dan Gilroy,"Jake Gyllenhall, Rene Russo",3.1,3.2,2.8,1.3,2.6,nightcrawler.jpg,thriller,https://xmovies8.si/watch-nightcrawler-2014-1080p.63014-hd-online-free/watching.html,https://gdurl.com/iEyE,https://www.youtube.com/embed/UXnKOuUHQAI
50,Take me somewhere nice,"If the quote- 'It's the journey and not the destination that matters' is adjoined to a movie, this one might be it. It is about a teenage dutch girl who sets out on a journey in Bosina (her hometown but had to flee due to war) to find her father who's been terminally ill. Accompanying her are her cousin and his accquiantance. Not your essential road-trip movie, but it provides a youthful perspective to matters. The beauty here lies more in the complex dynamics between the 3 rather than the story itself. But the main selling point for me here is the magnificant cinematography- use of soft yet vivid colours, shooting in tight angles so as to just capture the essence, the 4:3 aspect ratio really adds to the setting. Also, the film does not feature any pan shots and has very few instances of having a background score- thus giving it a realistic feel. All-in-all, this dutch movie might not be for everyone, but it certainly provides a fresh outlook on the genre of movies whose center focus is travel/",0,0,2019,Ena Sendijarevic,Sara Luna Zoic,2.6,2.3,3.8,2.4,2.75,somewhere nice.jpg,international,,https://gdurl.com/UO6CM,https://www.youtube.com/embed/ccD2vK47RK8
51,1917,"A tour-de-force of a film this is! Making a war film always requires a humongous budget because of the sheer size, special effects and a pelothra of side actors. Not to mention the amount of time and work it must take to make it as realistic as possible. And 1917 comes as close to realism as any war movie possibly can! It portrays the life in the trenches during WW1 and the risks and hazards that the soldier must undertake. It has been made as a single shot movie (and thus commands greater respect as to how could Sam mendes possible shoot scenes in such narrow trenches!) The film also has beautiful instances of humanity and takes necessary pauses whereever required. The detailing is immaculate and really transports you to that erra and the cinematography makes you resonates with what the soldiers are feeling mentally. This is a must watch movie for the war-movie enthusiats out there!",0,0,2020,Sam Mendes,"George MacKay, Dean-Charles Chapman",3.3,3.7,4.4,2.3,3.42,1917.jpg,true-story,https://xmovies8.si/watch-1917-2019-1080p.13595-hd-online-free/watching.html,https://gdurl.com/D5I4,https://www.youtube.com/embed/YqNYrYUiMfg
52,Get Out,"The biggest mindbender of a movie on 2017 (possibly the decade?). You will never anticipate the ending in a million years! It is that good! The movie starts creating a sense of errieness and continuously gives off unsettling vibes. In the majority of the movie everyone's smilling but there's a constant sense of impending doom. The acting by Daniel Kaayula is just spectacular and at no point would you ever want to leave your seat! What makes this such a spectacular psychological horror is that this movie won't mess around with your brain. The clues are wide open for all to see. The thrill here would rather be the greater picture that these clues point to. It invovles Chris who has been invited to he girlfirend's parent's house for a party but slowly discovers there's a far sinister purpose to his visit. Even if you are a fan of horror/thriller or not, this is a must watch!",1,0,2017,Jordan Peel,"Daniel Kaluuya, Allison Williams",3.4,3.9,2.4,1.7,3,get out.jpg,psychopath,https://xmovies8.si/watch-get-out-2017-1080p-hd-online-free/watching.html,https://gdurl.com/hoNS,https://www.youtube.com/embed/AHEl7Pji0f8